506,That Which Is Not To Be Named,None,None,None,25,Warrior,Dark_Legion,1,"PERSONALITY. The Great Darkness; Lord of all Apostles. May never participate in combat or be in cover. While in play, any Doomtrooper wounded by a Dark Legion warrior is automatically killed."
405,Demnogonis - the Befouler,None,None,None,20,Warrior,Dark_Legion,4,"PERSONALITY. APOSTLE. May never participate in combat or be in cover. While in play, as three actions, you may discard any Doomtrooper in play by paying its V in D. You do not earn any points for this."
401,Dark Huntsman,5,5,5,6,Warrior,Dark_Legion,1,"FOLLOWER OF ALGEROTH. Corporate Doomtroopers may not attack the Huntsman, but Brotherhood warriors may. Corporate Doomtroopers get -3 to their A when battling a Huntsman."
901,Dark Mystic,4,5,5,7,Warrior,Dark_Legion,1,HERETIC. This warrior may receive Ki Powers as if it was a Mishima warrior. It may receive DARK SYMMETRY GIFTS as normal (but not GIFTS OF APOSTLES). The Dark Mystic is not affected by cards that affect MYSTICS.
577,Eaonian Justifier,None,None,None,10,Warrior,Dark_Legion,1,"FOLLOWER OF ALGEROTH. May never participate in combat or be in cover. If any of your FOLLOWERS OF ALGEROTH wounds (not kills) a Doomtrooper and survives the combat, the Justifier may IMPRISON the Doomtrooper. The prisoner's attached cards are discarded. P"
123,Ezoghoul,5,8,7,8,Warrior,Dark_Legion,1,FOLLOWER OF ALGEROTH.
21,Blessed Legionnaire,2,2,1,3,Warrior,Dark_Legion,1,FOLLOWER OF DEMNOGONIS. Warriors wounded by Blessed Legionaires are autmoatically killed.
665,Venom Bat,None,1,1,1,Warrior,Dark_Legion,1,"FOLLOWER OF ILIAN. May never be affected by any other cards (except attacking warrior cards) or perform Attack actions. If you inspect a player's hand with a SCOUT BAT, the Venom Bat may automatically discard all warrior cards that you pick during the ins"
431,Golem of Darkness,6,5,7,7,Warrior,Dark_Legion,1,"FOLLOWER OF ALGEROTH. The Golem may not be given any Dark Symmetry cards. If the Golem is wounded, it is immediately healed unless the wound causes the Golem to be automatically killed."
827,Golgotha-Mistress of Symmetry,None,None,None,12,Warrior,Dark_Legion,1,FOLLOWER AND NEPHARITE OF ALGEROTH. PERSONALITY. May never participate in combat or be in cover. May provide any Dark Legion warrior with any Dark Symmetry card at any time with no action cost. May cast any Art spell on any warrior.
347,Golgotha - The Warrior Princess,14,None,6,12,Warrior,Dark_Legion,1,FOLLOWER AND NEPHARITE OF ALGEROTH. PERSONALITY. May never participate in Shoot combat or be in cover. May only be wounded by a Doomtrooper equipped with a Relic.
715,Golgotha Unleashed,8,None,8,12,Warrior,Dark_Legion,1,FOLLOWER AND NEPHARITE OF ALGEROTH. PERSONALITY. May never participate in a Shoot combat or be in cover. May only be wounded by a Doomtrooper equipped with any Relic. May cast any Art spell on any warrior.
348,Guardian Gargoyle,1,1,4,4,Warrior,Dark_Legion,1,"FOLLOWER OF SEMAI. IMMUNE TO THE ART. May never use the Dark Symmetry. While in your Kohort, your Special cards that remain in play may not be discarded."
655,Supreme Necromagus,4,4,5,5,Warrior,Dark_Legion,1,"FOLLOWER OF ALGEROTH. CONSIDERED A HERETIC. While in play, all your HERETICS (but not the Necromagus itself) gain +3 to F, S and A."
442,Ilian - Mistress of the Void,None,None,None,20,Warrior,Dark_Legion,1,"PERSONALITY. APOSTLE. May never participate in combat or be in cover. While in play, your Dark Legion warriors may receive any Gift of any Apostle at any time with no action cost. Ilian may cancel any immunity against the Dark Symmetry at any time."
444,Ilian Temple Sentinel,3,3,4,5,Warrior,Dark_Legion,1,"FOLLOWER OF ILIAN. Considered a TEMPLAR. While in play, all your TEMPLARS are immune to the Art."
922,Kadaver,2,2,2,2,Warrior,Dark_Legion,1,"FOLLOWER OF ALGEROTH. May never have Equipment, Relic or Dark Symmetry cards. For each additional Kadaver in your Kohort, this Kadaver gains +3 to F, S, and A, but only +1 to V. GRIM REAPER may not be played on a Kadaver."
388,Callistonian Conqueror,6,6,6,7,Warrior,Dark_Legion,1,"FOLLOWER OF SEMAI. Considered a CALLISTONIAN INTRUDER. While in play, all warriors wounded by CALLISTONIAN INTRUDERS are automatically killed."
31,Callistonian Intruder,4,4,6,6,Warrior,Dark_Legion,1,"FOLLOWER OF SEMAI. If wounded, the Callistonian Intruder may heal itself at any time by spending 6D."
803,Callistonian Sundancer,12,4,7,9,Warrior,Dark_Legion,1,FOLLOWER OF SEMAI. The Sundancer automatically kills any Dark Legion warrior it wounds.
609,Karnophage ,2,2,2,3,Warrior,Dark_Legion,1,"FOLLOWER OF ALGEROTH. Each Karnophage in your Kohort will automatically kill one wounded warrior of your choice (never a Nepharite) during each of your Discard phases. No points are earned. If there is no wounded warrior in play, the Karnophage is discard"
153,Heretic,2,2,2,3,Warrior,Dark_Legion,1,"You may bestow Dark Symmetry Gifts on the Heretic, but not GIFT OF APOSTLE cards."
40,Child of Ilian,1,3,2,2,Warrior,Dark_Legion,1,FOLLOWER OF ILIAN.
271,Screaming Legionnaire,3,2,1,3,Warrior,Dark_Legion,1,"FOLLOWER OF MUAWIJHE. NO DARK SYMMETRY CARDS ALLOWED. Once per game as 3 actions you can invoke WINDS OF INSANITY. For each of your Screaming Legionnaires , every warrior in play takes 1 point of damage. If this is equal to or greater than a warriors A is it wounded."
928,Kritana,9,8,10,11,Warrior,Dark_Legion,1,"PERSONALITY. FOLLOWER AND NEPHARITE OF ILIAN. While in play, all your FOLLOWERS OF ILIAN (but not Kritana herself) gain +4 to F, S and A. She may bestow any FOLLOWER OF ILIAN with any Dark  Symmetry card, except those restricted to specific warrior types."
367,Algeroth Cultist,3,3,3,3,Warrior,Dark_Legion,1,"FOLLOWER OF ALGEROTH. CONSIDERED A DOOMTROOPER WITH NO AFFILIATION AND A DARK LEGION HERETIC. Add the Cultist only to your Squad. May receive legal Dark Symmetry cards. May not  attack Brotherhood warriors. On a case-by-case basis, the Cultist's player ma"
406,Demnogonis Cultist,4,3,2,3,Warrior,Dark_Legion,1,"FOLLOWER OF DEMNOGONIS. CONSIDERED A DOOMTROOPER WITH NO AFFILIATION AND A DARK LEGION HERETIC. Add the Cultist only to your Squad. May receive legal Dark Symmetry cards. May not attack Brotherhood warriors. On a case-by-case basis, the Cultist's player m"
443,Ilian Cultist,2,4,3,3,Warrior,Dark_Legion,1,"FOLLOWER OF ILIAN. CONSIDERED A DOOMTROOPER WITH NO AFFILIATION AND A DARK LEGION HERETIC. Add the Cultist only to your Squad. May receive legal Dark Symmetry cards. May not attack Brotherhood warriors. On a case-by-case basis, the Cultist's player may ch"
459,Muawijhe Cultist,3,2,4,3,Warrior,Dark_Legion,1,"FOLLOWER OF MUAWIJHE. CONSIDERED A DOOMTROOPER WITH NO AFFILIATION AND A DARK LEGION HERETIC. Add the Cultist only to your Squad. May receive legal Dark Symmetry cards. May not attack Brotherhood warriors. On a case-by-case basis, the Cultist's player may"
484,Semai Cultist,4,2,3,3,Warrior,Dark_Legion,1,"FOLLOWER OF SEMAI. CONSIDERED A DOOMTROOPER WITH NO AFFILIATION AND A DARK LEGION HERETIC. Add the Cultist only to your Squad. May receive legal Dark Symmetry cards. May not attack Brotherhood warriors. On a case-by-case basis, the Cultist's player may ch"
640,Scout Bat,None,1,1,1,Warrior,Dark_Legion,3,"FOLLOWER OF ILIAN. May never be affected by any cards (except attacking warrior cards) or perform Attack actions. As two actions, the Scout Bat may look at any number of randomly picked cards in any player's hand. You must first pay 1 D per card."
61,Curator,3,4,3,4,Warrior,Dark_Legion,1,FOLLOWER OF DEMNOGONIS.
941,Red Guard Legionnaire,6,5,6,7,Warrior,Dark_Legion,1,"FOLLOWER OF ALGEROTH. While in play, all your UNDEAD LEGIONNAIRES gain +5 to F, S, A and V and automatically kill anyone they wound. For each Red Guard Legionnaire in your Kohort, SALADIN gains +1 to F and S, no matter where he is in play."
188,Legionnaire of Semai,1,2,3,2,Warrior,Dark_Legion,1,FOLLOWER OF SEMAI. 
838,Last Ritesman,3,7,8,7,Warrior,Dark_Legion,4,"FOLLOWER OF DEMNOGONIS. As three actions, the Ritesman may transform any non-Personality Doomtrooper in play into a FOLLOWER OF DEMNOGONIS. It loses all other affiliations and now-illegal attached cards."
929,Maledrach,6,5,8,10,Warrior,Dark_Legion,1,PERSONALITY. NEPHARITE AND FOLLOWER OF ALGEROTH. Maledrach may receive any Dark Symmetry Gifts AND those Gifts that are restricted to HERETICS. Maledrach is not considered a Heretic.
618,Mercurian Maculator,8,14,6,6,Warrior,Dark_Legion,1,"FOLLOWER OF ALGEROTH. May only be added to your Kohort if you have a MERCURIAN WARZONE in play. If all your MERCURIAN WARZONES are discarded, all your Mercurian Maculators are also discarded (no points are earned)."
554,Brass Apocalypt,6,13,10,7,Warrior,Dark_Legion,1,"FOLLOWER OF ALGEROTH. When you put the Brass Apocalypt into play, assign it to a Dark Legion warrior in your Kohort with V: 6 or less. The chosen warrior may not be attacked while the Apocalypt is in play. If the chosen warrior is somehow killed or discar"
353,Michaelis the Apostate,3,3,5,7,Warrior,Dark_Legion,1,HERETIC. PERSONALITY. May cast all aspects of the Art. May be bestowed with all Dark Symmetry cards.
458,Muawijhe - Lord of Visions,None,None,None,20,Warrior,Dark_Legion,1,"PERSONALITY. APOSTLE. May never participate in combat or be in cover. While in play, all Dark Legion warriors attack their opponents first in combat. If opponent survives, it may strike back."
214,Necromutant,4,4,4,4,Warrior,Dark_Legion,1,FOLLOWER OF ALGEROTH.
219,Nepharite of Algeroth,11,5,6,8,Warrior,Dark_Legion,1,FOLLOWER OF ALGEROTH. IMMUNE TO THE ART.
220,Nepharite of Demnogonis,4,5,2,5,Warrior,Dark_Legion,1,"FOLLOWER OF DEMNOGONIS. Every 1 D it spends on a Dark Symmetry effect is actually worth 2 D toward that effect. If wounded, the Nepharite can heal itself by spending 7 D."
221,Nepharite of Ilian,8,5,4,7,Warrior,Dark_Legion,1,FOLLOWER OF ILIAN. IMMUNE TO THE ART. A warrior wounded in a Fight combat by the Nepharite of Ilian is automatically killed.
222,Nepharite of Muawijhe,6,8,3,7,Warrior,Dark_Legion,1,FOLLOWER OF MUAWIJHE. IMMUNE TO THE ART. Brothers wounded by the Nepharite are killed and resurrected under your control. Place a Screaming Legionnaire card from your collection into your Kohort. If you can't still discard the Brother.
223,Nepharite of Semai,5,4,5,6,Warrior,Dark_Legion,1,"FOLLOWER OF SEMAI. IMMUNE TO THE ART. Warriors wounded by the Nepharite are killed. If the Nepharite kills a warrior, place a LEGIONNAIRE OF SEMAI from your collection into your Kohort. You still earn points from the kill."
241,Pretorian Stalker,12,3,8,7,Warrior,Dark_Legion,1,"FOLLOWER OF ALGEROTH. Dark Symmetry cards may not be bestowed on Pretorian Stalkers. If you have two Pretorian Stalkers in your Kohort, both their F and S increase by +2."
852,Pretorian Behemoth,13,7,9,10,Warrior,Dark_Legion,1,FOLLOWER OF ALGEROTH. Considered a PRETORIAN STALKER. Immune to the Art. May not use Dark Symmetry. The Behemoth gains +2 to F if another PRETORIAN STALKER is in the same Kohort.
738,Metropolitan Prophet,4,5,5,7,Warrior,Dark_Legion,1,"CONSIDERED A FOLLOWER OF ALL FIVE APOSTLES. The Prophet always attacks first in combat. If the opponent survives, it may retaliate."
359,Ragathol,10,4,6,7,Warrior,Dark_Legion,1,"PERSONALITY. FOLLOWER AND NEPHARITE OF ALGEROTH. While Ragathol is in your kohort, Doomtroopers killed by your Heretics are removed from game."
250,Razide,9,2,7,7,Warrior,Dark_Legion,1,FOLLOWER OF ALGEROTH.
855,Saladin,12,8,10,11,Warrior,Dark_Legion,1,FOLLOWER AND NEPHARITE OF ALGEROTH. PERSONALITY. Immune to the Art. Saladin may not be in the same Kohort as ALAKHAI THE CUNNING and may only attack ALAKHAI if he is in play.
634,Reaper of Souls,8,3,6,6,Warrior,Dark_Legion,1,FOLLOWER OF ALGEROTH. CONSIDERED A HERETIC. Warriors wounded by the Reaper in a Fight combat are automatically killed.
483,Semai - Lord of Spite,None,None,None,20,Warrior,Dark_Legion,1,"PERSONALITY. APOSTLE. May never participate in combat or be in cover. While in play, Doomtroopers are allowed to attack any other Doomtrooper in play (not in the same Squad), and they must pay 4D to attack Dark Legion warriors."
658,TechnoMancer,3,3,4,5,Warrior,Dark_Legion,1,FOLLOWER OF ALGEROTH. CONSIDERED A HERETIC. The Technomancer may be equipped with any Equipment cards regardless of affiliation restrictions.
504,Tekron,4,4,3,6,Warrior,Dark_Legion,4,"FOLLOWER OF ALGEROTH. While in play, as three actions, the Tekron may replace one of your Heretics with any non-personality follower of Algeroth from your collection. You must pay the new warrior's normal V in D and remove the Heretic from the game."
316,Templar,4,7,5,6,Warrior,Dark_Legion,1,FOLLOWER OF ILIAN.
159,Immaculate Fury,5,12,7,8,Warrior,Dark_Legion,1,FOLLOWER OF ALGEROTH.
605,Immaculate Spawn,3,9,6,6,Warrior,Dark_Legion,1,"FOLLOWER OF ALGEROTH. Whenever the Immaculate Spawn kills a Doomtrooper, you may immediately replace the Spawn with an IMMACULATE FURY from your collection. All cards attached to the Spawn stay in play on the IMMACULATE FURY."
818,Doomsday Proclaimer,3,7,7,5,Warrior,Dark_Legion,1,"FOLLOWER OF MUAWIJHE. While in play, you and all your FOLLOWERS OF MUAWIJHE are immune to the Art."
329,Undead Legionnaire,3,1,2,2,Warrior,Dark_Legion,1,FOLLOWER OF ALGEROTH.
531,Valpurgius,4,4,7,8,Warrior,Dark_Legion,1,"PERSONALITY. FOLLOWER AND NEPHARITE OF ALGEROTH. Valpurgius is Alakhai's Archmagus, and may provide any follower of Algeroth with any Dark Symmetry card at any time with no action cost. He warps the Art and may cast any Art spell on any warrior."
537,Zenithian Slaughtermaster,9,2,4,7,Warrior,Dark_Legion,1,"FOLLOWER OF MUAWIJHE. Considered a ZENITHIAN SOULSLAYER. While in play, warriors wounded by ZENITHIAN SOULSLAYERS are automatically killed."
342,Zenithian Soulslayer,7,2,6,6,Warrior,Dark_Legion,1,FOLLOWER OF MUAWIJHE.
575,Destroyer,7,7,7,7,Warrior,Dark_Legion,1,FOLLOWER OF ALGEROTH. CONSIDERED A HERETIC. Warriors wounded by the Destroyer are automatically killed and permanently removed from the game.
559,Citadel Sanctum ,+3,+3,+3,x2,Warzone,Dark_Legion,1,GENERIC WARZONE. ADD TO YOUR KOHORT IF YOU ARE A GRAND TACTICIAN. Warriors defending from this Warzone automatically kill any Doomtrooper they wound. Doomtroopers who kill warriors defending from this Warzone earn double the V of the opponent.
598,Helstrom Mountains ,+2,-3,+3,+4,Warzone,Dark_Legion,1,"VENUSIAN WARZONE. ADD TO YOUR KOHORT IF YOU ARE A GRAND TACTICIAN. If your warrior kills a Doomtrooper in a Shoot combat while defending from this Warzone, your earn double points."
569,Crater of Anatholia ,-3,+1,+2,+2,Warzone,Dark_Legion,1,MERCURIAN WARZONE. ADD TO YOUR KOHORT IF YOU ARE A GRAND TACTICIAN. Warriors defending from this Warzone may freely receive any legal Dark Symmetry cards during combat and automatically kill opponents they wound in Fight combats.
627,Phobos & Deimos ,+1,+1,-1,+2,Warzone,Dark_Legion,1,"MARTIAN WARZONE. ADD TO YOUR KOHORT IF YOU ARE A GRAND TACTICIAN. FOLLOWERS OF SEMAI and MUAWIJHE defending from this Warzone against attacking Doomtroopers gain an additional +5 to F, S and A."
606,Infested Asteroid ,+2,0,+3,+2,Warzone,Dark_Legion,1,"ASTEROID BELT WARZONE. ADD TO YOUR KOHORT IF YOU ARE A GRAND TACTICIAN. Warriors defending from this Warzone against attacking Imperial warriors gain an additional +5 to F, S, A and V."
909,Eye of Algeroth,None,None,None,None,Relic,Dark_Legion,1,"GIVE TO ANY HERETIC. While in play, this Heretic may have any number of copies of legal Dark Symmetry cards attached to it. Their effects are cumulative (when applicable). If the Eye is discarded, ALL Dark Symmetry cards on the Heretic are discarded as we"
346,Dagger of Sacrifice ,None,None,None,None,Relic,Dark_Legion,1,"GIVE TO ANY DARK LEGION WARRIOR IF YOU ARE A NOTED COLLECTOR. While in your Kohort, you may at any time discard a Brotherhood warrior in your Squad to cancel the effect of an Art card, or to discard an Art card that remains in play."
464,Necromakina,None,None,None,None,Relic,Dark_Legion,1,"PLAY ON A CITADEL IN YOUR KOHORT IF YOU ARE A NOTED COLLECTOR. Every time you kill a Doomtrooper, you MAY search through your collection and select a Dark Legion warrior whose V is not higher than the killed warrior's. Immediately place it in your Kohort."
532,Vault Of Unholy Restoration,None,None,None,None,Relic,Dark_Legion,1,"GIVE TO ANY DARK LEGION WARRIOR IF YOU ARE A NOTED COLLECTOR. While in play, equipment cards played on your Dark Legion warriors that are killed are not discarded; instead they are shuffled into your draw pile. If this warrior is killed, his equipment is "
448,Krynston's Skull,None,None,None,+4,Relic,Dark_Legion,1,"GIVE TO ANY DARK LEGION WARRIOR IF YOU ARE A NOTED COLLECTOR. While in play, your Dark Legion warriors who kill Followers of other Apostles earn 4 additional points for the kill."
468,Orb of the Smaller Servants,3x,3x,3x,3x,Relic,Dark_Legion,1,"GIVE TO A DARK LEGION WARRIOR IF YOU ARE A NOTED COLLECTOR. While in play, all your UNDEAD, SCREAMING and BLESSED LEGIONNAIRES, all your LEGIONNAIRES OF SEMAI and all your CHILDREN OF ILIAN triple their unmodified F, S, A and V. Only pay normal V when add"
947,Soul Well,+1,+1,+1,None,Relic,Dark_Legion,1,"GIVE TO ANY FOLLOWER OF ILIAN. While in play, any Doomtrooper killed by any FOLLOWER OF ILIAN in play is annihilated. This warrior also gains +1 to F, S and A for every Doomtrooper killed by any FOLLOWER OF ILIAN in play."
482,Scroll Of Unholy Invocation,None,None,None,None,Relic,Dark_Legion,4,GIVE TO A DARK LEGION WARRIOR IF YOU ARE A NOTED COLLECTOR. Remove the Scroll from the game as three actions to invoke one APOSTLE from your collection. The APOSTLE is immediately placed in your Kohort for free.
507,The Black Gate ,+x,+x,None,5_each,Relic,Dark_Legion,1,"GIVE TO A DARK LEGION WARRIOR IF YOU ARE A NOTED COLLECTOR. For every 5D, this warrior may bring another of your Dark Legion warriors in play into battle as a reinforcement. The group adds together their F and S for the combat. Opponent may choose which w"
951,Symmetry Stone,None,None,None,None,Relic,Dark_Legion,1,GIVE TO ANY DARK LEGION WARRIOR. All Dark Symmetry cards in the same Kohort as the Stone may not be discarded or annihilated unless this card is discarded first (or placed in the MUSEUM).
375,Armor of Unholiness,None,None,+4,None,Relic,Dark_Legion,1,GIVE TO ANY DARK LEGION WARRIOR IF YOU ARE A NOTED COLLECTOR. ARMOR. Adds +4 to A. The user is immune to all effects of the Art and may be bestowed with any Gift of Apostle card. A warrior only be equipped with one suit of armor.
399,Curse of Algeroth,None,None,None,4_each,Special,Dark_Legion,0,"PLAY ANY TIME YOU HAVE A FOLLOWER OF ALGEROTH IN YOUR KOHORT. You may immediately discard one special card currently in play. For every 4D, you may discard any one additional special card in play."
536,Wrath of Algeroth,None,None,None,None,Special,Dark_Legion,0,"PLAY AT ANY TIME. All equipment cards in play are discarded, except those held by followers of Algeroth."
41,Chosen,None,None,None,None,Special,Dark_Legion,0,PLAY ON ANY DL WARRIOR AT ANY TIME. This warrior may be bestowed with DSG from any Apostle.
309,Tainted!,None,None,None,None,Special,Dark_Legion,0,"PLAY ANY TIME ON ANY DOOMTROOPER. This warrior is now a Dark Legion spy. It keeps all Doomtrooper memberships, but it is also considered a Heretic of the Dark Legion. Dark Symmetry cards can be played on it."
776,The Curator's Gift,None,None,None,None,Special,Dark_Legion,1,"ATTACH TO ANY FOLLOWER OF DEMNOGONIS AS ONE ACTION. The affected warrior may use POISONS, as if it was a MORTIFICATOR."
68,Dark Visitation,None,None,None,None,Special,Dark_Legion,0,"PLAY ON ANY DOOMTROOPER ANY TIME. This warrior is now considered a Heretic of the Dark Legion, not a Doomtrooper. All cards that affect Heretics affect this warrior as well, and Dark Symmetry Gifts may be bestowed on it."
721,Illumination,None,None,None,None,Special,Dark_Legion,1,ATTACH TO ANY WARRIOR WITH DARK SYMMETRY IMMUNITY AS ONE ACTION. The affected warrior is no longer immune to any Dark Symmetry cards.
421,Eternal Curse,None,None,None,None,Special,Dark_Legion,0,PLAY ON ANY WARRIOR AT ANY TIME. THIS CARD REMAINS IN PLAY. The affected warrior may never be affected by special cards other than this and any cards canceling this card. All special cards currently in play on the affected warrior are discarded.
641,Secret Assassin ,None,None,None,8,Special,Dark_Legion,0,"PLAY AT ANY TIME. ONCE USED, REMOVE THIS CARD FROM THE GAME ENTIRELY. For 8 D, and one Doomtrooper in play is discarded. You may only use this card against one Doomtrooper. This is not considered an Attack action."
124,Fallen From Favor,None,None,None,None,Special,Dark_Legion,0,"PLAY ON ANY DARK LEGION WARRIOR AT ANY TIME. One of the warrior's Dark Symmetry cards, choosen by you, is discarded."
748,Powerful Command,None,None,None,None,Special,Dark_Legion,3,PLAY DURING YOUR TURN AS THREE ACTIONS. Every warrior in your Kohort must attack a separate Doomtrooper in play (if able). Choose Attackers and Defenders (only one Attacker per Defender). Your extra Kohort members do nothing. Conduct each attack separatel
845,Mutiny,None,None,None,x/2,Special,Dark_Legion,1,"PLAY AS ONE ATTACK ACTION ON AN ENEMY DARK LEGION WARRIOR THAT MAY PARTICIPATE IN COMBAT, THEN REMOVE THIS CARD FROM GAME. The warrior attacks its controller and you earn half its modified V (rounded down) in Promotion Points."
215,Necromutant Frenzy,None,None,None,None,Special,Dark_Legion,0,"PLAY AT ANY TIME. For the remainder of the game, all NECROMUTANTS resolve their attacks first when Fighting (not Shooting). If the opponent survives, it may then attack the NECROMUTANT. This has no effect if the opponent is another NECROMUTANT."
358,Primal Bitch,-,-,-,0,Special,Dark_Legion,0,"PLAY WHENEVER AN OPPONENT ADDS AN WARRIOR. This card replaces the added warrior, which is reshuffled in it's players Draw Pile. The Bitch may never participate in combat^but is considered a warrior and a PERSONALITY. While in a players Squad/Kohort no oth"
57,Corrupt Shield,None,None,None,None,Special,Dark_Legion,0,PLAY ON A DARK LEGION WARRIOR AT ANY TIME. The affected warrior is immune to the Art. This card remains with the warrior.
683,Blessed by Apostle,None,None,None,None,Special,Dark_Legion,1,"ATTACH TO ANY DARK LEGION WARRIOR AS ONE ACTION. The affected warrior is now considered a FOLLOWER of any one Apostle (chose which one) in addition to any other affiliation. It may receive GIFTS of that Apostle, provided it is allowed to have Dark Symmetr"
488,Skepticism,None,None,None,None,Special,Dark_Legion,0,"PLAY AT ANY TIME. THIS CARD REMAINS IN PLAY. While in play, the Brotherhood may be attacked by non-Brotherhood Doomtroopers. The Brothers may not attack Doomtroopers or each other."
295,Stigmata,None,None,None,None,Special,Dark_Legion,0,PLAY ANY TIME ON A HERETIC WITH AT LEAST 1 DSG. It is forever a member of the DL and may receive any DSG from any Dark Apostle at any time for no action cost.
775,Terrorist Attack,None,None,None,None,Special,Dark_Legion,0,PLAY AT ANY TIME. You may immediately remove any Brotherhood-affiliated Fortification from the game.
595,Grim Reaper ,2x,2x,2x,2x,Special,Dark_Legion,2,"PLAY ON ANY DARK LEGION WARRIOR OF V; 4 OR LESS AS TWO ACTIONS. THIS CARD REMAINS IN PLAY. Affected warrior's F, S, A and V are doubled."
653,Sudden Death,None,None,None,None,Special,Dark_Legion,0,PLAY DURING A FIGHT COMBAT IN WHICH YOUR DARK LEGION WARRIOR IS DEFENDING AGAINST A DOOMTROOPER. The Doomtrooper is immediately discarded. No points are awarded.
582,Excrutiating Power Flow,2x,2x,2x,2x,Special,Dark_Legion,0,PLAY AT ANY TIME ON A WARRIOR USING A DARK SYMMETRY ABILITY. The effects of one of the warrior's Dark Symmetry cards are doubled (when applicable) until the beginning of your next turn.
783,Trust in the Arms,None,None,None,None,Special,Dark_Legion,1,PLAY AS ONE ACTION. All warriors in play lose the ability to cast Art spells until the beginning of your next turn. This includes any warriors added after this card has been played.
525,Transfiguration,None,None,None,x,Special,Dark_Legion,0,PLAY AT ANY TIME ON ANY HERETIC. The Heretic has become transfigured. Remove the Heretic card from the game and put any non-personality follower of Algeroth from your draw pile in its place. You must pay the normal V of the follower.
696,Currency Exchange,None,None,None,x,Special,Dark_Legion,0,"PLAY AT ANY TIME DURING A TEAM GAME. When played, you and your partner(s) may freely move D between one another."
669,Admonish Resistance,None,None,None,None,Special,Dark_Legion,3,"PLAY AS THREE ACTIONS. THIS CARD REMAINS IN PLAY. While in play, all Dark Legion warriors in play may only attack Brotherhood warriors if there are any in play. A player is not forced to attack his or her own warriors."
365,Age of Catastrophe,None,None,None,5_each,Special,Dark_Legion,3,"PLAY AS THREE ACTIONS. THIS CARD REMAINS IN PLAY. You must spend 5D when this card is played. When played, all equipment cards in play are discarded. While in play, no equipment cards may be played."
774,Temporary Insanity,None,None,None,10,Special,Dark_Legion,0,"PLAY WHEN YOUR DARK LEGION WARRIOR IS ATTACKED BY A DOOMTROOPER AND SPEND 10 D. The Doomtrooper goes insane! Choose any other warrior in play; the Doomtrooper attacks that warrior instead. If either warrior is killed, you earn the points."
832,Imperial,None,None,None,None,Alliance,Imperial,0,"ALLIANCE. Refer to the ALLIANCES RULES CARD. If your Imperial warrior is wounded when combating a Dark Legion warrior, it is immediately healed unless the wound causes the warrior to be automatically killed."
