120,Exorcism Empathy,None,None,None,None,Special,Brotherhood,1,"PLAY ON ONE OF YOUR BROTHERHOOD WARRIORS AS ONE ACTION. From now on, all Brotherhood warriors in your Squad may use the Art of Exorcism. If the warrior is killed, this card is discarded."
204,Mentalism Empathy,None,None,None,None,Special,Brotherhood,1,"PLAY ON ONE OF YOUR BROTHERHOOD WARRIORS AS ONE ACTION. From now on, all Brotherhood warriors in your Squad may use the Art of Mentalism. If the warrior is killed, this card is discarded."
183,Kinetic Empathy,None,None,None,None,Special,Brotherhood,1,"PLAY ON ONE OF YOUR BROTHERHOOD WARRIORS AS ONE ACTION. From now on, all Brotherhood warriors in your Squad may use the Art of Kinetics. If the warrior is killed, this card is discarded."
199,Manipulative Empathy,None,None,None,None,Special,Brotherhood,1,"PLAY ON ONE OF YOUR BROTHERHOOD WARRIORS AS ONE ACTION. From now on, all Brotherhood warriors in your Squad may use the Art of Manipulation. If the warrior is killed, this card is discarded."
239,Premonition Empathy,None,None,None,None,Special,Brotherhood,1,"PLAY ON ONE OF YOUR BROTHERHOOD WARRIORS AS ONE ACTION. From now on, all Brotherhood warriors in your Squad may use the Art of Premonition. If the warrior is killed, this card is discarded."
36,Changeling Empathy,None,None,None,None,Special,Brotherhood,1,"PLAY ON ONE OF YOUR BROTHERHOOD WARRIORS AS ONE ACTION. From now on, all Brotherhood warriors in your Squad may use the Art of Changeling. If the warrior is killed, this card is discarded."
1073,Redirect,None,None,None,None,Special,Brotherhood,0,"Play immediately after any Art spell is cast. The spell does not affect ist intended target. Instead, you may redirect that spell towards any player, even yourself. Once there the spell MUST then affect a legal target, chosen by you."
719,Hidden,None,None,None,None,Special,Brotherhood,1,"ATTACH TO ANY MORTIFICATOR AS ONE ACTION. While in play, affected warrior may not attack or be attacked. You may remove this card from the game at any time (except during combat) to allow the warrior to make a free and immediate Attack."
871,Touched by the Light,None,None,None,None,Special,Brotherhood,0,PLAY ON ANY HERETIC AT ANY TIME. This warrior has been turned to the forces of good and is now considered a non-affiliated Doomtrooper. All attached Dark Legion affiliated cards are discarded. This card will cancel DARK VISITATION and TAINTED.
535,Wave of Righteousness,None,None,None,10_each,Special,Brotherhood,0,"PLAY AT ANY TIME. For every 10D, any one warrior in play, regardless of affiliation, is discarded. This is not considered an attack. Once cast, this card is taken out of the game instead of simply discarded."
726,"It Shall Be Done, Excellency",None,None,None,2x,Special,Brotherhood,0,"ATTACH TO ANY BROTHERHOOD WARRIOR AT ANY TIME. Choose one of the five Apostles. While in play, each D spent while casting Art spells against Followers of that Apostle counts as 2 D."
524,Tithe,None,None,None,2_each,Special,Brotherhood,1,"PLAY AS ONE ACTION. Each player must give you 2D for every Brotherhood warrior in his or her Squad (not Kohort). If a player does not have enough D, take the remainder from the common pool. Then discard this card."
585,Fizzle ,None,None,None,None,Special,Brotherhood,0," PLAY IMMEDIATELY AFTER ANY ART SPELL IS CAST. Spell is mis-cast and ineffective. The spell is discarded, and has no effect on play. Any actions or D spent casting the spell are wasted."
804,Capitol,None,None,None,x,Alliance,Capitol,0,ALLIANCE. Refer to the ALLIANCES RULES CARD. You may add Capitol warriors to your Squad at any time with no action cost. You must still pay the warrior`s V in D.
281,"Sherman.74 Modell 13 ""Bolter""",+2,+2,None,None,Equipment,Capitol,1,HANDGUN. FIGHT/SHOOT WEAPON. Warrior gains +2 to F and S. A warrior may attack using two handguns.
3,AH/UH-19 Grapeshot Guardian,None,x2,x2,x2,Equipment,Capitol,1,"When flying this airship, the warrior's S, A and V are doubled. No other weapons may be used when using the Guaridan."
593,Great Grey,None,None,None,None,Equipment,Capitol,3,"GIVE TO ANY COMMANDER. AIRSHIP AND VEHICLE. A warrior may only have one VEHICLE. The warrior may not use Equipment while using the Great Grey. As two actions, warrior may STRAFE any one warrior in play. A Strafed warrior automatically Seeks Cover (if norm"
412,"DPAT-9 ""Deuce""",None,+6,None,None,Equipment,Capitol,1,"GIVE TO ANY CAPITOL WARRIOR. SHOOT WEAPON. ROCKET LAUNCHER. Warrior gains +6 to S, and may use an Attack action to discard any vehicle or fortification card in play. The warrior may not discard a vehicle or fortification when attacked."
33,Capitol Sword of Honor,+1,None,None,None,Equipment,Capitol,1,MAY ONLY BE GIVEN TO A CAPITOL DOOMTROOPER. FIGHT WEAPON. The warrior gains +1 to F.
633,Rattlesnake,None,+5,None,None,Equipment,Capitol,1,GIVE TO ANY CAPITOL WARRIOR. VEHICLE. A warrior may only have one VEHICLE. Warrior gains +5 to S. The warrior may not use Equipment when using the Rattlesnake. The warrior may attack two opponents as one attack action. Choose two targets before combat beg
224,Nimrod Autocannon,None,+3,None,None,Equipment,Capitol,1,ARTILLERY. SHOOT WEAPON. +3 to S. The warrior may attack two opponents in one attack action. Choose two targets before combat begins. The same warrior may be attacked twice. Treat each attack separately.
626,Pegasus Scout Bike,None,None,+3,None,Equipment,Capitol,1,"GIVE TO ANY CAPITOL WARRIOR WITH V: 4 OR LESS. AIRSHIP and VEHICLE. A warrior may only have one VEHICLE. Warrior may use other Equipment while using the Pegasus. This warrior flies recon and also gives +3 to A for all warriors in the same Squad, including"
247,Purple Shark,None,+4,+4,None,Equipment,Capitol,1,"AIRSHIP. A WARRIOR CAN ONLY HAVE 1 AIRSIP. While flying this airship, the warrior's S and A are +4. For 5D it may escape a Fight combat. When the warrior uses the Purple Shark, flip a coin. If heads, the warrior is wounded, and the purple shark is discarded."
176,Internal Affairs Crackdown,None,None,None,2x,Mission,Capitol,1,ASSIGN TO ANY CAPITOL DOOMTROOPER. This warrior must kill a Capitol Doomtrooper to complete the mission and earn twice the normal V. The mission-holder may attack non-Personality Capitol Doomtrooper until mission is fulfilled or otherwise removed.
269,San Dorado,None,None,+2,None,Fortification,Capitol,1,THIS CARD MAY BE ADDED TO YOUR SQUAD AS ONE ACTION. CAPITOL CITY. All of your Capitol members gain +2 to their A while SAN DORADO is in play. You may not have two identical Cities in play simultaneously.
18,Big Bob Watts,5,8,7,7,Warrior,Capitol,1,"PERSONALITY. CONSIDERED A FREE MARINE. While Big Bob is in play, all of your Free Marines are immune to the effects of Dark Symmetry cards."
557,Captain,6,8,7,9,Warrior,Capitol,1,"COMMANDER (CAPTAIN). While in your Squad, all your Capitol warriors with V: 8 or less automatically kill anyone they wound."
809,Chris Jackson,4,8,8,7,Warrior,Capitol,1,"PERSONALITY. CONSIDERED A SEA LION. While in play, all your SEA LIONS (but not Jackson himself) gain + 3 to F, S and A and may use any non-Dark Legion Equipment."
107,Ex-Capitol Freelancer,2,4,2,1,Warrior,Capitol,1,"Points earned by the Freelancer must be made into D. The warrior may use cards meant for Capitol warriors, but only if you pay 3 D when each card is played."
586,Flight Commander,5,9,7,9,Warrior,Capitol,1,"COMMANDER (CAPTAIN). While in the Squad, all of your Capitol warriors with AIRSHIPS, and all Capitol warriors that are considered AIRSHIPS or VEHICLES, gain +3 to their F, S, A and V. The Commander will not affect its own ratings, but others may."
136,Free Marine,4,6,4,5,Warrior,Capitol,1,"The Free Marines are made out of highly commendated, highly decorated vets that have been court-martialled for some reason and now fight to restore their personal rep."
912,Freedom Brigadeer,3,7,6,7,Warrior,Capitol,1,"CONSIDERED INFANTRY. The Black Hole Suns may attack any warrior, regardless of affiliation."
588,General Michael Kell,7,11,9,12,Warrior,Capitol,1,"PERSONALITY. While in the Squad, all of your Capitol warriors (but not Kell himself) gain +3 to their F, S, A and V."
351,Hunter - Special Forces Bad Ass,9,4,7,7,Warrior,Capitol,1,May never become a Heretic. May spend two actions tmake one fight atack with doubled modified F.
164,Infantry,2,3,2,2,Warrior,Capitol,1,"The Capitol Ground Forces comprise the largest army in the Solar system, but still maintain a high level of both personal skill and equipment."
833,Infantry Sniper,3,9,5,9,Warrior,Capitol,1,"May perform a Shoot attack against any warrior that attacks any other Capitol warrior in play. This attack occurs before the Battle Tactic is announced. The original combat continues if the warrior survives. If more than one Sniper wishes to Shoot, the or"
727,Jake Kramer,5,6,5,6,Warrior,Capitol,3,"PERSONALITY. Kramer may be given any non-Dark Legion Equipment. Kramer may use two actions to Attack and gain +5 to F, S and A."
187,Lane Chung,3,6,4,4,Warrior,Capitol,1,"PERSONALITY. Lane Chung likes to boast. To attack with him, you must announce it the turn before the attack. Then Lane must attack next turn. You do not have to signify the Defender or the battle tactic."
201,Martian Banshee,1,5,3,3,Warrior,Capitol,1,"Airborne troops used on Mars, the Martian Banshee units are solely composed of men and women who have lost friends or family to Mishima or the Dark Legion."
208,Mitch Hunter,4,7,7,7,Warrior,Capitol,1,"PERSONALITY. CONSIDERED AN INFANTRY WARRIOR. While Hunter is in play, all of your Infantry are immune to the effects of Dark Symmetry cards."
227,Pam Afton,2,5,4,4,Warrior,Capitol,1,"PERSONALITY. Pam Afton is Lane Chung's partner. If you have both PAM AFTON and LANE CHUNG in play, Lane Chung does not have to ""boast"" before attacking."
629,President Charles W. Colding,None,None,None,20,Warrior,Capitol,1,"PERSONALITY. CORPORATE LEADER. May never participate in combat or be in cover. While in play, you may convert any number of non-attack actions to attack actions, but they must be performed by Capitol warriors."
273,Sea Lion,3,4,4,4,Warrior,Capitol,1,The Sea Lions are the pride of the Capitol Navy; an elite amphibious strikeforce currently used in the Graveton Archipelago on Venus.
643,Sergeant,3,7,5,6,Warrior,Capitol,1,"COMMANDER (SERGEANT). Assign a non-Personality Capitol warrior card to the Sergeant. That card, and copies of that card in your Squad gain +4 to F, S, A and V while this warrior is in the Squad."
858,Sergeant Carter,2,6,8,7,Warrior,Capitol,1,"PERSONALITY. CONSIDERED INFANTRY. COMMANDER (SERGEANT). While in play all your non-Personality INFANTRY gain +4 to F, S and A. Other SERGEANTS have no effect on these cards."
302,Sunset Striker,3,3,3,3,Warrior,Capitol,1,"Deployed on Mercury, the Sunset Strikers act as Capitol's special commando unit for fighting Mishima troops on their own home planet."
817,Desert Scorpion,3,6,4,5,Warrior,Capitol,1,Desert Scorpions may attack in Shoot combat while in cover. May enter cover at any time without performing a Seek Cover action.
616,McCraig Line ,-1,+3,+2,+2,Warzone,Capitol,1,"MARTIAN WARZONE. ADD TO YOUR SQUAD IF YOU ARE A GRAND TACTICIAN. Capitol defending from this Warzone gain an additional +2 to F, S and A. When you have this Warzone in play, you may add TRENCHERS to your Squad with no action or point cost."
454,Mission Statement,None,None,None,None,Relic,Capitol,1,"GIVE TO ANY CAPITOL WARRIOR IF YOU ARE A NOTED COLLECTOR. While the Mission Statement is in play, you may convert up to three non-Attack actions during your turn to Attack actions. Only Capitol  warriors may conduct any extra Attack actions. All converted"
290,Special Commendation,None,None,None,None,Special,Capitol,0,"PLAY ON ANY NON-CAPITOL DOOMTROOPER AT ANY TIME. The affected warrior is now considered a member of the Capitol Corporation, in addition to any memberships it currently holds."
604,Honor Award,+1,+1,+1,None,Special,Capitol,0,"PLAY ON ANY DOOMTROOPER IMMEDIATELY AFTER IT KILLS A WARRIOR OF HIGHER TOTAL VALUE. THIS CARD REMAINS WITH THE WARRIOR. The affected Doomtrooper gains +1 to F, S and A. A warrior may have any number of Honor Awards."
601,Home Turf Mars,None,None,None,None,Special,Capitol,0,"PLAY AT ANY TIME ON A MARTIAN WARZONE. THIS CARD REMAINS IN PLAY. Capitol warriors defending from this Warzone may ignore all of the Warzone's negative ratings modifiers, and opponents wounded by defending Capitol warriors are automatically killed."
175,Insubordination,None,None,None,None,Special,Capitol,0,"PLAY ON ANY DOOMTROOPER ANY TIME. The warrior loses membership in 1 organization of your choice. Lose card-earned memberships first. If the warrior loses all memberships, it's a Freelancer until it gets another. Any points it earns become D."
599,Hero Award,+3,+3,+3,+3,Special,Capitol,0,"PLAY ON ANY DOOMTROOPER IMMEDIATELY AFTER IT KILLS A WARRIOR OF HIGHER TOTAL VALUE. THIS CARD REMAINS WITH THE WARRIOR. The affected Doomtrooper gains +3 to F, S, A and V. A warrior may have any number of Hero Awards."
1098,Torrent Battle Wagon,None,+3,+3,None,Equipment,Crescentia,1,GIVE TO A CRESCENTIA WARRIOR. VEHICLE. Provides +3 to S and A.
1087,Support Artillery Ox,0,0,+2,0,Beast,Crescentia,1,"GIVE TO A CRESCENTIA WARRIOR. A warrior with an Ox may attack a PLAYER as two actions, even if the opponent has warriors in play. This is considered an attack action. If successful the warrior only gains 3 Promotion Points."
994,Crescentian Twotusk,+4,0,+4,+4,Beast,Crescentia,1,GIVE TO A CRESCENTIA WARRIOR.
997,Eclipse Mammoth,0,0,0,0,Beast,Crescentia,1,"GIVE TO A CRESCENTIA WARRIOR. As three actions, antoher non-Beast Crescentia warrior in your Outpost may jump on the Mammoth's back (it may not jump off). It will hold three warriors. They add F, S, A and V together and are considered a single warrior during combat, but may be affected by cards individually. If discarded the warriors seperate."
1017,Holy Urox,+6,+2,+6,+3,Beast,Crescentia,3,GIVE TO A CRESCENTIA WARRIOR. A warrior with an Urox must spend two actions to attack.
1032,Mastodont,3,+2,+2,+4,Beast,Crescentia,1,"GIVE TO A CRESCENTIA WARRIOR. A warrior with a Mastodont may use up to two SHOOT or FIGHT/SHOOT WEAPONS during Shoot combats, and their effects are cumulative."
993,Crescentian Martyr,5,5,4,8,Warrior,Crescentia,1,"The Martyr behaves normally in combats except when combating a warrior with or considered a Beast. When it is, ist base F and S become 20, it automatically kills any warrior it wounds, and it is annihilated after the combat (points are earned by the opponent only if it would have wounded the Martyr anyway)."
1077,Sacred Tear,4,4,4,7,Warrior,Crescentia,1,"The Sacred Tear behaves normally in combats except when it attacks with a Fight combat. When it does, ist base F becomes 16, it automatically kills any warrior it wounds, and it is annihilated after the combat (points are earned by the opponent only if it would have wounded the Sacred Tear anyway)."
1024,Jihad Infantry Trooper,7,6,7,7,Warrior,Crescentia,1,May not be given Beasts.
980,Brotherbound Trooper,4,3,5,4,Warrior,Crescentia,1,May not be given Beasts. Warriors with or considered Beasts may not be attacked with Fight combats while in the same Outpost as the Brotherbound Trooper.
1033,Mastodont Handler,4,4,4,4,Warrior,Crescentia,1,"All Beasts (and warriors considered Beasts) in the same Outpost as the Handler provide an additional +2 to F, S and A to their owners. Multiple Handlers provide cumulative bonuses."
1066,Prophet,3,3,4,4,Warrior,Crescentia,1,The Prophet may not be attacked unless it is the only warrior in the Outpost (or all remaining warriors are Prophets).
979,Brotherbound Sergeant,6,5,7,6,Warrior,Crescentia,1,"COMMANDER. CONSIDERED A BROTHERBOUND TROOPER. While in play, your BROTHERBOUND TROOPERS gain +2 to F, S and A. The Sergeant may not increase ist own ratings, but others may."
985,Central Europe,+2,+2,0,0,Warzone,Crescentia,1,"DARK EDEN WARZONE. ADD TO YOUR OUTPOST. Only Crescentia affiliated warriors may defend from this Warzone (unless permitted by another card). Warzones using Beasts while defendeing from this Warzone gain an additional +3 to F, S and A."
1094,The Howling Is Upon Us,2x,2x,2x,None,Special,Crescentia,1,"PLAY AS ONE ACTION IF YOUR HAVE A PROPHET IN YOUR OUTPOST. PROPHECY. While in play, bonuses to F, S and/or A provided by all your Crescentia-affiliated Beasts are doubled. This card is annihilated at the beginning of your next turn."
1042,Our Enemy's Weakness Is Exposed,None,None,None,None,Special,Crescentia,1,"ATTACH TO A PROPHET IN YOUR OUTPOST AS ONE ACTION. PROPHECY. While in play, opposing warriors do not gain any positive modifiers from any card when they are attacked by your warriors. Negative modifiers are still applied. When the opposing warriors attack, all modifiers are applied as normal."
1067,Prophetic Vision,None,None,None,None,Special,Crescentia,0,"PLAY ON YOUR CRESCENTIA WARRIOR AT ANY TIME. While attached, the warrior is considered a PROPHET."
975,Behold The Future Possibilities,None,None,None,6_each,Special,Crescentia,1,"ATTACH TO A PROPHET IN YOUR OUTPOST AS ONE ACTION. PROPHECY. While in play, all your opponents must keep their hands face-up on the table for all to see. You must pay 6D at the beginning of each of your turns to keep this card in play. If you do not pay, this card is annihilated."
1043,Our True Enemy Is Revealed,+3,+3,+3,None,Special,Crescentia,1,"ATTACH TO A PROPHET IN YOUR OUTPOST AS ONE ACTION. PROPHECY.  Choose any non-Crescentia affiliation. While in play, your Crescentia warriors gain +3 to their F, S and A whenever combating warriors of that affiliation."
1044,Our Will Is Beyond Measure,+1,+1,None,1_each,Special,Crescentia,1,"ATTACH TO A PROPHET IN YOUR OUTPOST AS ONE ACTION. PROPHECY. While in play, you may increase any one of your Crescentia warrior's F or S by +1 for every D you spend during combat. D may continue to be spend throughout the combat. The warrior's F and S return to normal after the combat is over."
815,Cybertronic,None,None,None,None,Alliance,Cybertronic,0,ALLIANCE. Refer to the ALLIANCES RULES CARD. All your Cybertronic warriors may use all Equipment and Relic cards except those restricted to the Dark Legion.
886,Adrenaline Implants,None,None,None,None,Equipment,Cybertronic,3,"GIVE TO ANY NON-BROTHERHOOD DOOMTROOPER AS THREE ACTIONS. This warrior automatically heals itself when wounded (unless killed automatically), but each time it loses -1 to its base A. If the base A reaches 0, the warrior is discarded (no points are earned)"
32,CAP 7000P,None,2x,2x,2x,Equipment,Cybertronic,1,"AIRSHIP AND VEHICLE. MAY BE GIVEN TO ANY CYBERTRONIC DOOMTROOPER. A WARRIOR CAN ONLY HAVE 1 VEHICLE. When flying thsi airship, the warrior's S, A und V are doubled. No other weapons may be used when using the CAP 7000P."
919,Hardened Fist,2x,None,None,None,Equipment,Cybertronic,3,"GIVE TO ANY CYBERTRONIC WARRIOR. As two actions, this warrior may make a Fight combat at double its base F rating. Warriors wounded by the Fist are automatically killed."
907,Epidermal Plates,None,None,2x,None,Equipment,Cybertronic,1,GIVE TO ANY NON-BROTHERHOOD DOOMTROOPER. ARMOR. The warrior's base A rating is doubled. Modifiers to A are applied after this doubling. A warrior may only have one piece of ARMOR.
895,Brainwave Bomb,None,None,None,None,Equipment,Cybertronic,1,"GIVE TO ANY WARRIOR. If this warrior is killed in combat, you MUST set off the Bomb after combat is resolved. Its opponent is killed as well, and points are earned. This card and the warrior it is attached to are then annihilated."
566,Command Helmet,None,None,None,None,Equipment,Cybertronic,1,GIVE TO ANY COMMANDER. A warrior may only have one Command Helmet. This warrior may make one extra attack action every turn in addition to ist player's three actions.
320,Ticker,+2,+2,+2,None,Equipment,Cybertronic,1,"GIVE TO ANY NON-BROTHERHOOD DOOMTROOPER. The warrior may take Ticker during combat by discarding this card. Once taken, the warrior's F and S are +2, and it may not be wounded or killed. After the combat, Ticker wears off, and the warrior automatically receives one wound."
492,SSW4200P,None,+4,None,None,Equipment,Cybertronic,1,"GIVE TO ANY CYBERTRONIC WARRIOR. SHOOT WEAPON. HEAVY MACHINE GUN. Add +4 to S. If warrior's S total is more than double the opponent's A total in Shoot combat when using the SSW4200, opponent is automatically killed if wounded."
656,TA6500 Cybermech,None,None,None,1,Equipment,Cybertronic,4,"ADD TO YOUR SQUAD AS ONE ACTION. TANK and VEHICLE. By spending three actions and one Promotion Point, this remote-controlled tank will discard any one Equipment, Fortification or Warzone card in play."
657,Tactical Computer,->,<-,None,None,Equipment,Cybertronic,1,GIVE TO ANY COMMANDER. A warrior may only have one Tactical Computer. This warrior may change the Battle Tactics once during every combat in which it participates.
251,Recalled,None,None,None,None,Mission,Cybertronic,1,ASSIGN TO ANY CYBERTRONIC DOOMTROOPER. This warrior must kill a Cybertronic Doomtrooper to complete the mission and earn twice the normal V. The mission-holder may attack non-Personality Cybertronic Doomtroopers until mission is fulfilled or otherwise removed.
319,The HQ,None,None,+2,None,Fortification,Cybertronic,1,THIS CARD MAY BE ADDED TO YOUR SQUAD AS ONE ACTION. CYBERTRONIC CITY. All of your Cybertronic members gain +2 to their A while THE HQ is in play. You may not have two identical Cities in play simultaneously.
795,Atilla III,8,7,8,9,Warrior,Cybertronic,1,"PERSONALITY. CONSIDERED A CUIRASSIER. IMMUNE TO ALL DARK SYMMETRY CARDS. May never cast Art spells. While in play, all your CUIRASSIERS automatically kill anyone they wound."
419,Eradicator Deathdroid,4,13,10,12,Warrior,Cybertronic,1,"IMMUNE TO ALL DARK SYMMETRY CARDS. CONSIDERED A VEHICLE. May not use equipment, and may never be in cover. May never cast Art"
558,Charles Sykes,8,7,11,13,Warrior,Cybertronic,1,"PERSONALITY. IMMUNE TO THE EFFECTS OF DARK SYMMETRY GIFT CARDS, BUT NOT GIFTS OF APOSTLES. May never cast Art spells. While in the Squad, all of your Cybertronic warriors (but not Sykes himself) gain +3 to F, S, A and V."
38,Chasseur,5,2,4,5,Warrior,Cybertronic,1,"IMMUNE TO THE EFFECTS OF DARK SYMMETRY GIFT CARDS, BUT NOT GIFT OF APOSTLE CARDS. May never cast Art spells."
39,Chemiman,4,4,4,4,Warrior,Cybertronic,1,IMMUNE TO THE EFFECTS OF DARK SYMMETRY GIFT CARDS. Any warrior wounded by the ChemiMan is automatically killed.
814,Coral Beach,7,8,7,8,Warrior,Cybertronic,1,"PERSONALITY. CONSIDERED A CHASSEUR. IMMUNE TO THE EFFECTS OF DARK SYMMETRY GIFT CARDS, BUT NOT GIFTS OF APOSTLES. May never cast Art spells. While in play, all of your CHASSEURS (but not Beach himself) gain +2 to their F, S and A."
63,Cybercurity MP,3,3,4,3,Warrior,Cybertronic,1,"IMMUNE TO THE EFFECTS OF DARK SYMMETRY GIFT CARDS, BUT NOT GIFT OF APOSTLE CARDS. May never cast Art spells."
572,Cyril Dent,11,8,11,9,Warrior,Cybertronic,1,"PERSONALITY. CONSIDERED A CUIRASSIER. IMMUNE TO THE EFFECTS OF DARK SYMMETRY GIFT CARDS, BUT NOT GIFT OF APOSTLE CARDS. May never cast Art spells. Opponents of total V: 7 or less are automatically killed when wounded by Cyril."
659,The Nineteenth Executive,None,None,None,20,Warrior,Cybertronic,1,"PERSONALITY. CORPORATE LEADER. May never participate in combat or be in cover. While in play, you may convert any number of non-attack actions to attack actions, but they must be performed by Cybertronic warriors."
410,Doctor Diana,3,3,6,5,Warrior,Cybertronic,2,"PERSONALITY. IMMUNE TO THE EFFECTS OF DARK SYMMETRY GIFT CARDS, BUT NOT GIFT OF APOSTLE CARDS. If Diana is not in cover, you may spend one action to have her heal any wounded Doomtrooper in play. This causes Diana to immediately go into cover. May never c"
108,Ex-Cybertronic Freelancer,2,2,4,1,Warrior,Cybertronic,1,"Immune to the effects of DARK SYMMETRY GIFT cards, but not GIFT OF APOSTLE cards. Points earned by the Freelancer must be made into D. The warrior may use cards meant for Cybertronic warriors, but only if you pay 3 D when each card is played."
125,Fay & Klaus,3,3,3,5,Warrior,Cybertronic,1,"PERSONALITY. IMMUNE TO THE EFFECTS OF DARK SYMMETRY GIFT CARDS. This card is considered a single warrior. Fay and Klaus may battle as a team for 5 D. If so F, S, A and V are +3 until the end of the combat."
565,Combat Overseer,4,3,7,7,Warrior,Cybertronic,1,"COMMANDER (SERGEANT). IMMUNE TO THE EFFECTS OF DARK SYMMETRY GIFT CARDS, BUT NOT GIFTS OF APOSTLES. May never cast Art spells. Assign a non-Personality Cybertronic warrior card to the Combat Overseer. That card, and copies of that card in your Squad gain "
549,Battle Functionary,6,5,9,10,Warrior,Cybertronic,1,"COMMANDER (CAPTAIN). IMMUNE TO THE EFFECTS OF DARK SYMMETRY GIFT CARDS, BUT NOT GIFTS OF APOSTLES. May never cast Art spells. While in your Squad, all your Cybertronic warriors with V: 9 or less automatically kill anyone they wound."
60,Cuirassier,4,3,4,4,Warrior,Cybertronic,1,Immune to the effects of DARK SYMMETRY GIFT cards.
196,Machinator,3,3,3,3,Warrior,Cybertronic,1,"Immune to the effects of DARK SYMMETRY GIFT cards, but not GIFT OF APOSTLE cards. May never cast Art Spells."
328,Twitcher,2,2,2,2,Warrior,Cybertronic,1,"If the Twitcher is equipped with TICKER, ist F and S ratings increase by +1 in addition to the effects of TICKER. Twitcher is not wounded by TICKER."
530,Vac Engineer,3,3,3,4,Warrior,Cybertronic,1,"IMMUNE TO THE EFFECTS OF DARK SYMMETRY GIFT CARDS, BUT NOT GIFT OF APOSTLE CARDS. While in play, it may equip any Doomtrooper with any Cybertronic equipment card at any time with no action cost. It may also give any non personality Doomtrooper a Cybertron"
